post	label	language
Se l'aiuto politico ha acceso il tuo cuore, Basiliyah politico verrà a salvarti e a liberarti dal tuo incubo mattina, mezzogiorno e sera. Gebran Bassil	0	it
@user @user È meglio che la legge sulle molestie venga rimossa perché non è ragionevole per noi vivere in una bolla di risveglio che fa distinzioni tra i sessi... @url	0	it
Hai dimenticato che il padre e la madre di questo principe furono i primi a visitare il Libano dopo la guerra, visitarono il sud e lo finanziarono?	0	it
Non è un problema, ti togliamo il cugino, ci serve solo un favore	0	it
Vai e impara l'arabo, la prima cosa che sai è capire cosa si dice in inglese	0	it
Il poeta Abu Qasim Al-Shabbi disse: Se un giorno il popolo volesse la vita, allora il destino dovrebbe rispondere, e la notte dovrebbe finire, e...	0	it
Uno dei tanti espatriati single ti ha comprato	0	it
È semplice, adesso fanno un discorso pieno di sentimenti e un po' di settarismo, e la situazione se ne va e l'odore se ne va	0	it
Come desideri, ma questo sarà il secondo più lungo della vita di Gebran Bassil e del suo sogno per la presidenza.	0	it
E questa volta la popolazione di Ghouta ha subito un attacco chimico?	0	it
Maledici il popolo, il governo e i residenti del Qatar	1	it
Un greco-armeno con cittadinanza tedesca, nato in Siria, il che significa che suo padre era un rifugiato. Kalb Ibn Shehata in Siria è uno scrittore in prima linea per la sua stessa azienda. La Merkel deve andarsene. Grazie, Yahaif, per le fave e i ceci che hai mangiato nel nostro paese, figlio di Sarmaya.	1	it
Colonb ha confermato, durante un'intervista alla rivista Express, che la strategia di transito si limita a creare centri di transito per i rifugiati africani... @url	0	it
Nel video Gebran Bassil riconosce il diritto dell'entità sionista a garantire la propria sicurezza	0	it
Ma non sono sicuro che Silo mi faccia ridere molto, soprattutto quando cerca di fare qualcosa di divertente	0	it
Cosa avete fatto tu e i tuoi colleghi per Gerusalemme, insegnante?	0	it
Come se assomigliaste a dei giovanotti o mi sbaglio, Tommy?	0	it
Il presidente siriano valorizza e apprezza le posizioni di Sua Eccellenza e Ministro degli Esteri Gebran Bassil, che derivano dalla loro visione strategica del conflitto in Medio Oriente...	0	it
Vergogna a te e Wahab, quello che ti ha dato il certificato annuncia che siete entrambi più brutali l'uno dell'altro	1	it
Cambiate la costituzione e vedete se è settaria, vi darò quello che volete, comunque il ritorno dei cristiani non è un errore per il Libano, e questo	0	it
Gebran Bassil, tu rappresenti ogni grande e onorevole libanese, rappresenti ogni libanese ambizioso, sei il nemico di ogni politico letargico e sbadato, la cui identità e le cui idee sei tu, sei un nemico.	0	it
Tu e la tua specie siete schiavi del denaro, cercate crisi per il bene dei vostri interessi personali	0	it
Questo è tutto, amore mio, e non preoccuparti dell'argomento	0	it
Spero che ti ubriachi perché è finito abbastanza. Punizione per Wahab Wahab, l'assassino di Abu Diab	0	it
Pensi che io abbia paura di te? Voglio dire, ho paura di te e degli Emirati, di un popolo che non porta rispetto per te e per il tuo Paese.	1	it
Gli sciiti di Baalbek e del Sud lavorano in aziende e alberghi in Qatar, perché il Libano fa schifo, decidiamolo.	0	it
Significa che il diritto del mendicante ti sta piangendo, ahah	0	it
@user @user Questo patchwork non serve a nulla. La religione dei Magi è stata smascherata e ha svelato la sua copertura, e i giovani prima dei vecchi sanno che stanno seguendo la setta... @user	1	it
@user @user Perché chi maneggia un topo è la coda di un maiale	0	it
Spero che prima di provare a parlare, tu stia cercando la verità. Ma tutto ciò che ti interessa è registrare una posizione	0	it
Non siriano?? Chi e dove sei?? Esiste un cristiano nel Levante che non sia siriano??	0	it
Resteremo con voi per realizzare la logica della giustizia per tutti i membri della conosciuta setta	0	it
Chi vuole rispondere alla biografia del ministro disoccupato Gebran Bassil, vuole sentire discorsi più sporchi delle azioni del Movimento Amal.	1	it
Chi altro è il ragazzo volante, Gebran Bassil?	0	it
@user @user Le star africane sono le migliori al mondo, brasiliane comprese	0	it
Shu Khwaja Hal Khwaja	0	it
I diplomati di Al-Azhar organizzano a Matrouh una serata religiosa dal titolo: Le molestie sono un crimine contro le donne e la società	0	it
@user @user @user @user Non sappiamo come capire i bambini del piacere. L'urina di cammello è una bevanda solo a scopo terapeutico, ma come riferimento... @user	1	it
Gli Emirati superano il mondo in termini di stupidità	1	it
Parli di una questione che ha una spaccatura settaria nei risultati, tanto che non hanno messo i risultati nel cassetto	0	it
Tu sei il Redentore solo per chi ha un occhio solo	0	it
Gebran Bassil del World Economic Forum di Davos consiglia Londra e Washington	0	it
Buona fortuna, siamo con te e ti leggeremo	0	it
Nessuno ti ha costretto a restare qui	0	it
Gebran Bassil non ha detto il contrario, le sue parole sono state diplomatiche	0	it
Non vivrò per chi ha tradito la patria o alzato il suo livello = i suoi beni rimarranno perduti nel mercato e nessuno li comprerà	0	it
Nostro caro leader, cosa ti aspetti da uno stato così corrotto oltre ai furti e alle false promesse della gente di inondare il paese di debiti e accordi?	0	it
@utente Bray, asino!	1	it
Sham Roukoz e dopo di lui Gebran Bassil	0	it
Me lo hai detto senza mentire e rispetto la tua mente Domanda: Se te ne avessi parlato, mi avresti considerato educato? Ti ringrazio in ogni modo, con amore e rispetto	0	it
Recuperare il denaro rubato a rappresentanti e leader e imprigionarli è l’unica soluzione per questo Paese, e avremo una nuova patria e un nuovo popolo.	0	it
@user Sono tutte molestie, ma significa che non ci sono state molestie da 40 anni	0	it
Zio, qualcuno gli dia la cittadinanza siriana e gli lasci sostituire noi	0	it
Non ci aspettavamo testimonianze sulla lealtà del generale Aoun e sulla sincerità di Gebran Bassil, perché hanno scritto la storia con i loro nobili valori, ma siamo orgogliosi delle parole di Sua Eminenza, che hanno messo a tacere...	0	it
Oh Dio, le persone hanno cambiato i dati e sono ancora perso @url	0	it
Sembra l'harem, ok @url	0	it
Il deposito del Qatar è simile al gioco del debito pubblico	0	it
Un periodo di dipendenza e ostruzione. Sicuramente, chi può cambiare Gebran Bassil?	0	it
Rispettato, tu rispetti il ​​mondo intero tranne Gebran Bassil, e vuoi insultare Gebran Bassil. Io voglio insultarti.	0	it
Sayed Abdel Hafeez: Al-Ahly è a un nuovo appuntamento nella storia della Champions League africana	0	it
Incolpate il vostro cane, la nostra gente in Kuwait, questa parte dell'Arabia Saudita è un maiale sporco e vile che ci abbaia. È un peccato, è un peccato, è un peccato, è un peccato.	1	it
Nonostante le circostanze vissute dal Libano nella fase precedente della guerra di assassini e altre cose, non vedevo la situazione come quella attuale...	0	it
@user Dio dice (e restate nelle vostre case....) Sareste soddisfatti, relatore, che vostra moglie, figlia o sorella uscisse adornata in costume intero... @url	0	it
A prescindere dall’operato di alcuni suoi sostenitori, soprattutto sui social, che contribuiscono, intenzionalmente o meno, ad allargare la spaccatura.	0	it
@utente Hahahahaha il drone non è sotto un aeroporto...l'urina del cammello e il suo impatto sono evidenti...	1	it
Un musulmano sano e responsabile, un musulmano sunnita, uno sciita o un ebreo, sosterremo gli indù? Lasciamoci bruciare. C'è qualche profeta tra lui che sia scortese? #Saleh_Al-Fadala	0	it
Gebran Bassil, il pio popolo libanese lo deride	0	it
Che Dio ti protegga.La nazione è costruita dai suoi giovani	0	it
Ci siamo riusciti con le nostre forze. Grazie, Sua Eccellenza il Presidente e Sua Eccellenza il Ministro Gebran Bassil, per tutto quello che avete fatto affinché il vertice sullo sviluppo fosse un successo e perché avete sempre risollevato il Paese.	0	it
@user In termini di harem, i capelli ricci da soli sono grandi la metà delle ragazze europee.. Per Dio, Mohamed Salah ha alzato la testa degli arabi come la metà della Gran Bretagna.	0	it
Come se fossi suo cugino, lo difese e ne creò qualcosa come quaranta	0	it
Per Dio, tu sei un bugiardo, tu che hai la testa calva e una buona morale, ma l'uomo non ha mancato di strappare il resto dei capelli...	1	it
Abbiamo bisogno di uomini che non siano portavoce di regimi criminali	0	it
Un popolo spazzatura a cui piace bere urina di cammello e curarsi con l'acqua maschile @user	1	it
Forse è la strada verso uno stato di cittadinanza	0	it
Questo è l'Israele di cui Gebran Bassil ha affermato che non rifiuta l'esistenza di Israele e che la sua sicurezza è un suo diritto	0	it
Ci siamo annoiati di te la prima volta che eri arrabbiato e abbiamo riso di te	0	it
Certo, Gebran Bassil, e l'astuzia è nascosta?	0	it
Le parole di Jawaher sono fantastiche per te	0	it
Ministro	0	it
Una volta, qualcuno di Cuba che lavorava con me mi ha chiesto dei curdi, chi e quanto sono diversi dagli arabi. Sono rimasto un po' confuso e ho detto a Dio, non so cosa dirti, proprio come tutti altro, ma uno parla curdo e l'altro parla arabo.	0	it
Siamo con l'onorevole Ministro Gebran Bassil	0	it
Questa è una foto degli edifici del progetto Gebran Bassil su Eddeh Road a Batroun	0	it
@user @user Non è corretto affermare che non esiste alcuna relazione tra africani, bengalesi e uzbeki con J1	0	it
Gebran Bassil, non biasimarlo né criticarlo: solo chi non lavora non commette errori e chi rimane inattivo non acquisirà, ovviamente, alcuna esperienza.	0	it
Che le forze dell'ordine controllino anche le licenze artesiane: chi ha una trivellatrice sa come guadagnarsi da vivere, né chi ha soldi medi sa come pagare un pozzo d'acqua.	0	it
Resistente ai malati, questa salsa è siriana, fratello Reza o iraniana	1	it
@user @user Questo è l'errore: tutte le strade dovrebbero essere chiuse e i maiali Houthi sepolti negli scarichi fognari.	1	it
Ok, qual è il problema? Amo qualcuno chiamato Generale Aoun e amo qualcuno chiamato Gebran Bassil	0	it
La corrente della sedizione, della menzogna e dell'incitamento è la corrente degli stolti	1	it
Devi confermare che non esiste alcuna licenza, e dove sono, sfortunatamente, le persone della regione a Nabatieh, Hajjah Karmal, una tenda piastrellata in cui hanno imprigionato?	0	it
Secondo te, la scatola nera della Guardia rivoluzionaria iraniana sta piantando fiori per nostro conto	0	it
Questo miliardo non è per amore del Libano, né è una donazione o un dono per comprare le coscienze e comprare persone spregevoli per aiutarlo.	0	it
Presta attenzione alla tua situazione, non ti disturberà	0	it
Il Qatar è sinonimo di terrorismo	1	it
Tempo di Nasrallah, qual è l’opinione di Sayyed se Gebran Bassil venisse in Venezuela per sostenere l’asse della fermezza e del confronto e sistemare la situazione?	0	it
La sensazione peggiore è quando senti che qualcuno ti sta derubando e non riesci a fermarlo perché è lui a fermare te 😎	0	it
Certamente, Suleiman Bek Franjieh, con il nostro affetto e apprezzamento a Sua Eccellenza il Ministro Gebran Bassil	0	it
Per te, il regime siriano è stato vittorioso, e la corona sulla tua testa, tu druso, traditore, ferma il tuo appello alla cecità che ti acceca.	1	it
I tre più grandi bugiardi, anche studioso, sono il primo a dire che la voce di una donna è vergognosa, il secondo a dire che il ruolo della donna è nella casa, e il terzo a dire che la forza dell'uomo di sopportare è maggiore di quello di una donna.	0	it
Ogni volta che parli di annusare qualcosa che non va bene	0	it
Israele vince e ottiene il sostegno internazionale perché qualcuno lo chiama	0	it
Ok, prova a suicidarti così possiamo vedere	0	it
Tutti tirano per un violino	0	it
Che Dio benedica la sua mattinata, professor Wiam. Lei è il proprietario delle posizioni, della parola audace e dell'aquila della montagna	0	it
Gularji si è rivelato essere il fratello di Diani	0	it
Sei guarito, dottore? Non sei un seguace? Questa è colpa dell'Iran pazzo, contagioso, arretrato. Non hai trovato niente da lodare se non questa persona. Per ricordarlo...	1	it
E tu sei un outsider fanatico, ahah	0	it
Lo giuro su Dio, se lo facessi su Skype senza questa confusione	0	it
A chi attacca Gebran Bassil in postazione senza comprendere il contenuto del discorso diplomatico perché rivolto ai capi di Stato e ai loro popoli.	0	it
Gebran Bassil, espulso dall'Arabia Saudita in un precedente vertice, dopo il boicottaggio, non ha visto Tamim mentre passeggiava a Istanbul, né lo ha visto tra le braccia di Erdogan...	0	it
Sto bevendo sangue di maiale	1	it
Quella di Fratello Walid non è la prima presa di posizione del Primo Ministro Gebran Bassil, e poiché Sheikh Saad non ha posto fine a questa presa di posizione...	0	it
Sua Eccellenza il Ministro, restate nell'era preislamica, restate nell'era preislamica, e cosa volete in Qatar?	1	it
"Mi piace di più che le donne dicano ""extension"" e noi pensiamo che sia la ""grande Ford"" e che siano extension per capelli"	0	it
Mazen Ezzi Gebran Bassil, rappresentante di vendita siriano	0	it
E non solo Weam era alla porta, Aoun li ricevette e il principe Mujid ebbe incontri intimi con gli ebrei, alla presenza di Talal.	0	it
Noi, gente della montagna, non vi disdegniamo e non vi sconfessiamo. Vogliamo che voi in Venezuela vi esprimiate. Possa Dio rafforzare la nostra ragione e religione.	0	it
Sayyed Hassan Nasrallah nel dialogo generale con lui elogia la posizione del presidente Michel Aoun e del ministro Gebran Bassil al vertice economico arabo in Libano	0	it
I libanesi hanno un sistema digestivo per Gebran Bassil, anche se viene da Marte, ma viene digerito, che cos'è, ragazzi?	0	it
Ti amo, capo	0	it
Lo sporco è sporco, anche se lo lavi con l'acqua Zamzam...	0	it
Che Dio li bruci tutti tranne quante persone lavorano alla stazione, e quando finisce il Mondiale, loro bruciano, la stazione brucia e tutti diventano felici.	1	it
Dialetto Shawi classico	1	it
Weam Wahhab, tu sei un progetto di sedizione drusa. Tu, che canti dei tuoi drusi ogni giorno, come hanno fatto i tuoi drusi a permetterti di essere la punta di diamante di...	1	it
Di quali arabi stai parlando? Sceicco, che Dio ti guidi. L'importante è che le tasche siano piene, lo stomaco sia pieno e il cervello voli.	0	it
@user @user Questo è il problema di tutti i maialini Banna, pensano che tutti gli altri siano ubbidienti e obbedienti quanto loro, e questo lo dico agli altri... @url	1	it
Ma in realtà recentemente sono diventato figlio di un insegnante	0	it
Il tempo dei furfanti	0	it
#feednoly scusami ti parlo di mangiare carne di maiale, non so come stai	0	it
@user @user Hahahahahahahahahahahahahahahahahahahahahahahahahahahahahahahahahahahahahahahahahahahahahahahahahahahahahahahahahahahahahahahahahahahahahahahahahahahahahahahahahahahahahahahahahahahahahahahahahahahaha non biasimarlo affatto ha bevuto urina di cammello e non ci è abituato	1	it
Il diritto al velo	0	it
Ogni volta che sto nei trasporti, per strada o anche al lavoro, l'harem e le ragazze indossano anche un quarto di sciarpa...	0	it
Il ruolo della Siria in Libano è onorevole, avete dimenticato Michel Samaha	0	it
Per Dio, nessuno capisce il Qatar tranne te, Eccellenza il Ministro. Accetta il mio amore e il mio apprezzamento	0	it
Dove si colloca una persona nella scala sociale + la portata della sua capacità di influenzare l'ambiente circostante + la sua memoria e conoscenza di cose come... @url	0	it
Se Dio ha dato loro l'intelligenza in famiglia e non l'ha data a te, qual è il loro peccato?	0	it
E' semplice, l'importante è che la nostra perdita sia onorevole	0	it
Vedi, abbiamo bisogno di un miracolo perché tu capisca che Walid Jumblatt è il tuo leader e il leader della montagna e di tutto il Libano, ma la patria prescelta non ha bisogno di annessione...	0	it
Buona giornata. Cosa indossi oggi? Adoro quello che indossi così. Zio mio, c'è una mattina più bella di questa.	0	it
@user I suoi vestiti sono chiaramente attillati, ecco perché l'ha rapita con lui, onestamente è molto pretenziosa	0	it
@user @user Spoon, Pesci, Al-Muzafar, Shabarlu e metà di Bayra	0	it
Ciò che ti ha detto Al-Himalali è che è vietato adulare e toccare la terra per compiacere i tuoi padroni. Continuerò a dire il tuo famoso detto: Grazie, Qatar.	0	it
Quanti vecchi saggi sono diventati in Libano con la tua determinazione?	0	it
Analizzare e discutere la seguente frase: Un popolo abituato a frequentare chi vuole capire cosa ha detto Gebran Bassil	0	it
Gebran Bassil è il numero difficile, e il presidente Aoun è il numero più difficile, e lo ha dimostrato sin dal suo ritorno dall’esilio, e non ora	0	it
Quali sono le novità sulla sega di Khashoggi, democratici?	0	it
Video: Lo hanno picchiato a morte... Questo è quello che hanno fatto gli indù a un giovane musulmano in India davanti alla polizia!	0	it
@user @user Pulito dalla pulizia, non pulito. Dove ha studiato? Non c'è niente di sbagliato in qualcuno che beve urina di cammello, te lo faccio sapere	0	it
@user Non importa, domani una fatwa del maiale Golani verrà a combatterli con il pretesto che sono Takfiri Kharijiti, agenti delle isole Al-Waq Waq... @url	1	it
@user Ora è una pervertita e se n'è andata. Questo è il destino di tutti coloro che hanno deviato dall'Islam. Sono contrario a uccidere chiunque, ma chi accetta una sorella che si veste da cavaliere a volte lo accetta.	0	it
Questa è la prova più evidente che la campagna non è contro di lui in quanto turco o musulmano, ma piuttosto contro la posizione politica o il simbolismo politico della questione perché, in fin dei conti...	0	it
I pensatori di tutto il mondo sono come l’opposizione siriana	0	it
In effetti, la migliore descrizione per te è #island_pigs	0	it
Gli arabi cercano di risolvere i vostri problemi che vanno avanti da un anno e poi guardano al destino degli altri che sono ipocriti	1	it
Divertiti, Abu Hadi	0	it
George Rook è un cane crudele e corrotto come te. Vedremo quanto George Rizk vuole essere un uomo crudele e corrotto. Tu, circasso, non sei lungo, e nemmeno la tua famiglia, per l'amor di Dio.	1	it
"Fratello mio, te l'abbiamo detto, stiamo dicendo: ""Le tue anime sono sulla Siria, poiché fornisce benzina sulle strade e fornisce telefoni e fax. Che Dio ti benedica""."	0	it
Sii caro e non inchinarti, non importa quanto sia necessario, perché potresti non avere l'opportunità di alzare di nuovo la testa Omar Al-Mukhtar	0	it
Se rivedi le tue interviste, le tue dichiarazioni, i tuoi detti, i tuoi scritti, vedrai che sei la persona che più accusa tutti, attacca tutti e insulta tutti secondo la parola.	0	it
Che Dio ti protegga, leader, hai ragione	0	it
Gebran Bassil è un cristiano che ha deluso i suoi correligionari ed è stato fustigato dai cristiani libanesi di tutte le sette cristiane.	0	it
Non puoi vivere senza provocare tentazioni giorno e notte, digli che la questione riguarda il padrone	0	it
Il puledro cinguetta e pensa di essere un cavallo, parli con Al-Awni in modo obiettivo e lui risponde come una bestia spregevole, crostosa come il suo bestiame.	1	it
Così, Al-Khawaja è riuscito a convincere Faisal Karami ad abbandonare il ministro sunnita	0	it
Hai visto un uccello che preferisce restare nella sua gabbia per paura dei proiettili del cacciatore?	0	it
Oh, ci sono persone che non dormono	0	it
Gebran Bassil, Ministro degli Esteri del Libano, la Siria deve ritornare nell'abbraccio arabo	0	it
#voa: “I rifugiati si insinuano sul grande schermo al Kenyan Film Festival” @url @url	0	it
A Parigi nevica da ieri, da dove viene il sole?	0	it
Hai ragione, non esiste lo Stato. Lo giuro su Dio, è strano come sei. Ieri continuavo a maledire lo Stato e i servizi di sicurezza. Adesso dov'è lo Stato?	0	it
Abbiamo un hamburger king, un mac out e cose che non avevo mai visto prima, e un supermercato tutto maiale, non so chi abbia il fegato la mattina per mangiare hamburger e patatine fritte.	0	it
Le mie forze sono arrabbiate	0	it
Cosa c'è che non va in te, ti amo	0	it
@user @user Bere l'urina di cammello non è menzionato nel Corano, né lo è la coppettazione. Quando critichi un libro, dovresti leggerlo, non… @url	0	it
Sua Eccellenza il Ministro, vanno bene le due opzioni	0	it
Purtroppo, Presidente, la gente non è consapevole della propria condizione	0	it
Inoltre, se il tuo cuore soffre per i terroristi dell'ISIS e di Jabhat al-Nusra che sono stati uccisi dall'esercito siriano e che sono stati deportati da...	0	it
Grazie significa ammettere che Michel Aoun e la sua squadra stanno alimentando il conflitto tra i drusi, ma per vostra informazione, il professor Weam Sheikh Al-Gharib, con	0	it
@user @user Fieno e urina di cammello, che arrivano ogni giorno dall'alleanza del male e del ritardo nello Yemen. Siete occupanti, da Tahesh Al… @user	1	it
La clip contiene musica e una donna truccata e, se la ritwitti, parteciperai al peccato	0	it
Signore, il Libano è passato sotto il controllo dell'Iran attraverso la sede presidenziale. Prendiamo il discorso di Gebran Bassil al vertice...	0	it
@user @user @user Che Dio ti conceda il successo e conceda al tuo Paese la vittoria sui maiali dei Magi	1	it
Grazie, Qatar, per aver salvato la lira. Amore, oh amico, che ama la tua mascolinità	0	it
Una legge settaria dettagliata basata sulle sette è ciò che ha prodotto ufficiali de facto come Imad Othman	0	it
Viene tutto dall'harem	0	it
"Lei parla da un punto di vista settario. Non è suo onore. Guardi, signor Resistenza. Perché ha inviato un messaggio a Sheikh Saad? Un alto funzionario di Hezbollah ha trasmesso ad Hariri un messaggio di Nasrallah: ""Con te, sia che tu sia un oppressore o persona oppressa”."	0	it
Dai tempi del servizio WhatsApp, i ricavi delle società di telecomunicazioni sono diminuiti in tutto il mondo, tranne quelle che vietano WhatsApp	0	it
Un bacio, un bacio, un bacio, un tweet, come se fossi Fawaz Al-Aloun	0	it
Infatti, che tu sia eletto o non eletto, andranno fuori strada	0	it
Il ministro degli Esteri libanese Gebran Bassil, Sua Altezza l'Emiro del Qatar, ha rotto l'assedio imposto al nostro Paese ed è venuto a Beirut con un'iniziativa per rompere l'assedio.	0	it
Abu Rida, vergognati se dici che è uno stato del Qatar e tu vieni da uno stato o da un distretto del Libano	0	it
Per Dio, voi siete indù e non c'è differenza tra voi sciiti.	1	it
La dimensione dei miei sandali e la dimensione dei sandali sulla tua testa sono esattamente la stessa, o Abdul Magi. Possa tu e la cavalla di Magus ottenere la vittoria di Satana, figlio di Mut'ah.	1	it
Questo tipo di corpo è canceroso: che vergogna per un popolo simile, uno Stato simile e una magistratura simile	1	it
La partecipazione di Sheikh Al-Gharib non è venuta dal tuo peso e da quelli con te, o Kabir, è venuta dai tuoi operatori nelle stanze nere e dalle loro intenzioni criminali di piantare	0	it
Ma Gibran Bassil dice	0	it
Ecco, questo è un esempio dell'ingiustizia causata da Gebran Bassil e dal Movimento Arancione, questo è il risultato del nostro silenzio	0	it
In Libano, se apri un ristorante, anche se lo chiami Ristorante Al-Hawa, e il ristorante ha successo, e Dio ti conceda il successo, duemila persone verranno da te e apriranno ristoranti accanto a te, imitando il nome...	0	it
Le sue scuse sono arrivate da Sheikh Saad, che ha preso parte della sua trasmissione radiofonica per te, lasciandolo con la preoccupazione di non riuscire a riprendersi e di essersi arrabbiato.	0	it
Davanti ai miei occhi, qualcuno che è un bravo scrittore non può parlare troppo di molestie e questa tendenza generale non è una cospirazione per emancipare le donne - semplicemente odio questa parola... @url	0	it
Con tutto onore e rispetto, il popolo fedele ricorda la generosità del popolo di Damasco, che ha abbracciato i libanesi nella loro dura prova, gli iracheni e i palestinesi...	0	it
Dovresti nominarmi presidente della Lega Ebraica, infatti stai mescolando arabismo e Arabia Saudita, resta nel tuo lato migliore, sempre alla grande.	0	it
Sousse: Un bambino guardiano di una barca è stato arrestato con l'accusa di aver molestato una bambina di 6 anni @url	0	it
Per Dio, il Libano, la storia culturale del Libano e i grandi nomi politici che lo hanno attraversato non meritano affatto la loro immagine	0	it
Certo, Gebran Bassil, e non c'è paragone con nessun altro	0	it
Ci è mancato, Sua Eccellenza Ministro, che tu fossi la voce più forte per difendere il Patto e chiunque rappresenti il ​​Patto come un nemico della tua voce nelle menti delle persone ❤	0	it
Con tutta la tua mente, c'è qualcuno o una grande autorità in questo paese? Dietro i vostri clienti, tutto il Paese, compresi i suoi abitanti, è diventato piccolo, piccolo, piccolo. Che Dio si vendichi di voi	0	it
Al-Hasbani, con il riconoscimento di chi apprezza il lavoro dei ministri, è uno dei migliori. Il criterio per valutare le persone è confrontarle con un ministro come Cesar Bou Khalil...	0	it
Non sembri siriano, ma affermi di esserlo	0	it
Il ministro degli Esteri libanese Gebran Bassil: Se Israele vuole mantenere la propria sicurezza, è un suo diritto	0	it
Non mi sono mai divertita molto oggi.. ho spiegato il maiale, ragazzi @url	0	it
Questo è l'esercito elettronico contro Wahhab. Qual è la sua storia? La carovana cammina e abbaia. Anche se non mi piace Wahhab, questo esercito elettronico mi ha fatto scrivere questo.	0	it
Imad Othman ti pesterà la testa, se Dio vuole, e domani lo vedrà presto	0	it
Qual è la differenza tra estate e inverno??	0	it
Non deludere, togli semplicemente un'idea che mi è piaciuta, affinché i nostri aguzzini non continuino a mostrarci il loro dolore e la nostra ricompensa.	0	it
Ha bisogno di più di una scarpa	0	it
Le case sono rosse, perfino verdi, e la moschea è più onorevole e più pura di te	0	it
