post	label	language
Non c'è dubbio che il divorzio sia difficile per tutte le parti, ma se fosse un divorzio consapevole e senza problemi, i figli non verrebbero danneggiati...	0	it
Lui, Walid Jumblatt, sarà presto processato contro il Presidente della Repubblica, con un provvedimento rapido, perché ha ucciso i genitori di Diab, in collusione con Walid Jumblatt.Questo è il dossier.	0	it
Tu sei la voce della verità	0	it
Se avesse parlato... sulle labbra dell'harem sarebbe caduto il silenzio.	0	it
Come se fossero cinquanta o giù di lì? Ti è chiaro, ti giuro che la vita è una disattenzione	0	it
Notizie dalla Siria: raid ed esplosioni israeliane a Latakia, scontri armati tra le due ali del regime ad Hama e ritiro americano in contemporanea...	0	it
@user Noi telespettatori pensavamo che foste maiali, Al Jazeera	1	it
Chiarimento politico dell’equazione pace per la sicurezza che Gebran Bassil cerca di commercializzare con la frase: Israele ha diritto alla sicurezza a condizione che non aggredisca.	0	it
Mangi molto shawarma dal tuo insegnante?	0	it
Un bellissimo gesto da parte tua, signora Dima	0	it
Ora, in Working, il personaggio dell'eroe ama le piccole creature in generale, ma l'ho accettato perché è chiaro che la sua visione non è deviante	0	it
@user @user @user Che Dio maledica te e il tuo sovrano. La Palestina, cane, è un patrimonio islamico e non ha bisogno di maiali come te. Terra degli Harami... @url	1	it
Il male della sventura è ciò che ti fa sprofondare ogni giorno negli abissi del ridicolo della politica e della visione offuscata	0	it
E dare buone notizie di sollievo a coloro che sono pazienti	0	it
Un gregge di pecore a cui manca la capacità di pensare ma che rimugina su discorsi marci e senza senso	1	it
Peccato a questo livello di conversazione	0	it
Possa Dio proteggerci dal presidente e proteggere i servizi segreti da noi	0	it
@user @user @user @user Siete i muli del gruppo delle motoseghe... bevete urina di cammello... la stupidità vi ha abbandonato... @user	1	it
Capisco perfettamente che uno svedese o un americano siano razzisti nei confronti degli africani dalla pelle scura - anche se tra loro sono scomparsi - ma perché rimani tu... @url	0	it
Ricordami due mesi fa con chi eri e chi accusavi di essere uomo e tieni duro	0	it
@user Non c'è differenza tra voi, siete tutti maiali	1	it
Il NEPAD ha onorato la Dott.ssa Yasmine Fouad, Ministro dell'Ambiente, con un'onorificenza africana di alto livello, nel quadro delle attività della Conferenza dei Ministri dell'Ambiente... @url	0	it
Possa egli avere pietà di lei e donare pazienza alla sua famiglia	0	it
Voi, o cavaliere, o umile, o Rafidi, o magi degli arabi e dei beduini, vostro è l'onore, o privo d'onore	1	it
Che dire del forno che viola le leggi, costruito senza licenza su una proprietà pubblica a Khaldeh e di proprietà di Abbas Ibrahim? per me…	0	it
Non commentare gli altri nei modi degli altri	1	it
Gebran Bassil è il ministro più intelligente	0	it
Complimenti ai vincitori, ottimo lavoro	0	it
Ruanda occidentale...questa è la prova che il ministro Gebran Bassil non forma il governo...	0	it
Il nostro leader non ha eguali, che Dio lo protegga	0	it
La dichiarazione di Al-Azhar sulle molestie sessuali mostra il conflitto tra il movimento riformista e i responsabili di Al-Azhar, #Compass_with_Islam_Beheiri… @url	0	it
Vorrei che qualcuno mi facesse perdere la morale e colpisse Abu Al-Gheit con qualcosa Beirut	0	it
La politica è il rifugio dello scrittore fallito Michel Aflaq	0	it
Per Dio, nostro caro avvocato, i giorni hanno dimostrato che Gebran Bassil sta ostacolando tutto nel paese e nessuno può fermarlo...	0	it
Questa è una magistratura giusta davanti alla quale tutti compariamo con onore, ma il giudice politicizzato è destinato al carcere	0	it
I capi delle federazioni africane di tiro in visita al nuovo Canale di Suez @url	0	it
La nuova proposta di Sua Eccellenza il Ministro Gebran Bassil è un governo che includerà ministri dei nostri fratelli sunniti, e quindi daranno il settimo ministro per incontrarsi in consultazione...	0	it
I siriani sfollati chiedono sfacciatamente lo Stato libanese	1	it
@user Tutto l'equipaggio dei maiali, che Dio vi benedica, maiali cristiani e Nusayri, quanti soldi per Hajj e preghiera, e Kurtulmuş, sono sufficienti per essere metilato in... @url	1	it
Chi sei? Non venire all'ordine. Chi sei?	0	it
I buoni del Tesoro non sono un deposito, cioè un debito fruttifero, e non toglieranno questo mezzo miliardo dalla birra	0	it
Se esistesse un paese che si rispetti, saresti esiliato o imprigionato	0	it
In primo luogo, Sua Eccellenza il Presidente Generale Michel Aoun, e in secondo luogo, l’obiettivo del Professor Gebran Bassil è il bene del Libano, se sei come te.	0	it
Dov'è finita la tua professionalità, uomo calvo, Abdul Mal? Grazie per il tuo odio insignificante e sepolto nei confronti di Marsal Ghanem	1	it
Una famiglia notarile di tre fratelli con risultati recenti: Grace Issam Naeem, Alan Issam Naeem, Elie Issam Naeem, Gibran Bassil e Al-Naam.	0	it
Vai in cucina, orso stronzo	1	it
"Un mondo in cui si muore di fame, di bruciore, di freddo e di esplosioni. Nel nostro Paese esistono diversi tipi di morte. Quando qualcuno apre una porta dice: ""Sei fuori dal Paese, i miei occhi non moriranno""."	0	it
Come è successo tutto il tempo in cui i suoi seguaci, Al-Zaqifa, durante i giorni dell'occupazione siriana del Libano, il più famoso dei quali era Nasser Qandil, la presenza militare scomparve e...	0	it
Gebran Bassil Vogliamo insegnare all'America e a Londra a lasciare il Paese senza budget, ma ovunque vada Jarrasa	0	it
Non sono rappresentato da Gebran Bassil come ministro degli Esteri. Se desidera avere rapporti con Israele, non c'è problema, Eccellenza.	0	it
Una parola che prendi, una parola a cui rispondi	0	it
Un popolo banale, sporco, senza morale e senza onore, che vergogna	1	it
Acquistare crediti è un disastro	0	it
Il Libano è tuo o di qualcun altro? Cosa ci aspetta nell'era pre-islamica?	0	it
I profughi si aggrappavano a tutto ciò che dimostrava la loro appartenenza affinché i figli potessero ereditarlo dopo di loro. Così le tessere annonarie diventarono documenti di identità ed eredità, ma... @url	0	it
Ha ragione, non ha diritto a niente, saluti	0	it
L'anima di Damasco è un brutto spettacolo dopo di te	0	it
Agli occhi di una donna, la molestia rimane tale finché non la fa l'uomo giusto... e diventa flirt	0	it
La carta di Gebran Bassil è stata bruciata per un po', e ora sta semplicemente giocando per il bene del generale	0	it
Questo è certo, non cambierà nulla, e per te dirò una frase che esula dalle mie convinzioni, bravo a lui, Gebran Bassil, nella storia della Banca Cedros, in un certo senso...	0	it
@user Cosa significa questa bellezza!	0	it
Chi è questo Sheikh? Chi è Wahhab e chi è Talal? Non sono leali l'uno con l'altro, né in questo mondo né nell'aldilà. Non esiste una cosa come...	0	it
@user Questo è il velo di un maiale di sessant'anni. Questo è il cane di Alawneh	0	it
@user Sembra che la famiglia dello sceicco fosse composta da maiali cresciuti nella stessa stalla, signori e signori	1	it
Stai attenta, famiglia mia. ..La sorpresa continua nel Campionato Africano. .L'uscita di Wydad e Mazembe @url	0	it
Possa tu vivere a lungo, Sceicco della Montagna	0	it
Forse qualcuno imparerà	0	it
L'epoca forte, l'artista Zein Al-Omar, adoro Gebran Bassil, e il mio amore per lui deriva dal mio amore per la patria, ed è uno statista di successo che lavora	0	it
Damasco era, come dissero i rappresentanti, finché non la presero in consegna, la casa di Assad, e Damasco non era più Damasco e divenne nelle mani di Assad.	0	it
@user Anche se non ha sposi, sarà sola e sola, e nessuno penserà a lei come al popolo egiziano, signori.	0	it
Gebran Bassil comprò quindici mucche, ne piantò dieci e lasciò il resto a giocare nel frigorifero Qual è la quantità di olio nelle uova?	0	it
Prima che Gebran Bassil arrivasse alla Farnesina speravo nell’arrivo di un ministro dinamico, coraggioso, capace di difendere le costanti dell’entità	0	it
Chi ha fatto Gibran per il Libano per un anno dovrebbe dare un quarto	0	it
Non esistono animali beduini. Siamo in Siria. Se qualcuno dice che la religione è alawita o sunnita, gli verrà schiacciata la testa. Noi siamo la religione della Siria, voi beduini.	1	it
Lo giuro, mi sorprende quanto un nemico si preoccupi di te per così tanto tempo, e questo conta per lui	0	it
Che ti fanno? Non hai commentato la scena della milizia avvenuta davanti alla casa di Hassan Yaqoub, O Sharif, O Afif, perché lo sappiamo????	0	it
@user mahoub è proibito e non è un errore guidare un harem che ritiene di dover guidare - ogni mattina vedo 5 harem guidare	0	it
Cosa ne pensi, vieni con noi e lasciaci avere una patria?	0	it
@user Oh brava gente, per Dio, quindi per Dio, questo cane ti ha onorato con il collo di un maiale del Qatar, di un maiale turco e di un grosso maiale... @url	1	it
Il presidente Michel Aoun è sottoposto da molti anni a violente campagne di demonizzazione	0	it
Mi hai depredato, seguimi, non lasciare parte di me alla mia miseria	0	it
Comprendiamo che desideri che Walid Bey non interferisca nella magistratura, ma poiché non lo sappiamo, come fai a sapere che le prove sono chiare per il giudice?	0	it
Ti rendi ridicolo in tutto, a causa della tua preoccupazione per la questione araba e del tuo sangue per i popoli arabi	0	it
Queste persone che hanno espulso gli israeliani un giorno dovranno svegliarsi ed espellere i proprietari del corteo. Il Libano era il gioiello della regione, non è proibito...	0	it
Oh Antar, chi smetterà di punire Wahab Wahab, l'assassino di Abu Diab?	0	it
Giuro su Dio che vivrai ancora per poco, molto seriamente. Quelli che saranno vivi saranno già morti. Se avessimo uno Stato, tu e le persone come te sareste privati ​​dei diritti civili.	0	it
@utente @utente Cinghiale	0	it
Vedremo i cani di Zgharta, Libano, e Beit Franjieh, e vedremo come riusciranno a scappare e a districarsi	1	it
Lei chiede ai siriani di ritornare in Libano, vuole che lo accetti? Stai gridando e voglio sentire la ragione e il pensiero...	0	it
Possa il nome di Dio essere su di te, Sha’lat Zakka	0	it
Stai cercando di assicurarti, giornalista, chi c'è dietro questa pubblicità sponsorizzata e di commentare, ma hai un complesso saudita e un complesso settario.	0	it
Sham, oh spada, non è scomparsa	0	it
Giuro che sono cresciuto e ho iniziato a mandare delegazioni	0	it
Se esci e vedi una donna velata e adorna, come se dicesse: “Ecco”, allora prendi dalla castità di Giuseppe, la pace sia su di lui, e se vedi una donna casta e velata, allora prendi da la magnanimità di Mosè, la pace sia con lui.	0	it
Dimenticate tutto sulla cronologia di Gebran Bassil: sono passati due giorni e non ha visto nessuno che lo controllasse.	0	it
Armonia, dal tuo faro siamo guidati e uniti, la voce della consapevolezza e l'emergere della libertà. La nostra armonia è diventata come un albero fermo, il grande profumo.	0	it
La legge sulle molestie vieta rose e cuori	0	it
Sembra che tu non sia all’altezza dei tuoi doveri nazionali	0	it
Fermate il vostro scarafaggio, scarafaggio, traditore, agente, voi siete quelli schiavizzati dal signore feudale Walid Jumblatt, voi greggi, basta umiliazioni e calunnie, basta commercio con voi.	1	it
Un popolo abituato a frequentare chi vuole capire cosa ha detto Gebran Bassil?? Ci è voluta ancora un'ora per tradurre ciò che ha detto, reagire e tradurre...	0	it
E modi per correggere questo errore @url	0	it
Si scopre che qualcuno mi ha chiamato e ha detto che il ministro Gebran Bassil aveva chiamato il presidente russo e gli aveva detto di chiamare i leader partecipanti al vertice per...	0	it
Aouni, Dio non esiste	1	it
Lo giuro su Dio, nessuno vuole vedere uno psichiatra oltre a te. Sembra che il generale Othman, il tuo lavoro sia isterico	0	it
Siamo monoteisti fino al Giorno del Giudizio	0	it
Come di solito	0	it
Grazie, professor Wahab, Damasco è meravigliosa, e il nostro poeta, i deputati, che meravigliosi e belli, e i miei saluti a lei, ce li ha ricordati, lei meravigliosa e bella, grazie	0	it
Affinché una donna possa vivere come un essere umano e non come un essere inferiore a un uomo, perché non c'è nulla di scientifico che dimostri che lui sia in qualche modo migliore di lei, e poi le molestie o... @url	0	it
Awwww, il signor Hassan dimostra la sincerità del suo rapporto con Gebran Bassil, WikiLeaks, che si è rivolto all'America pubblicamente e segretamente, un altro discorso.	0	it
Non essere come Gebran Bassil	0	it
@user Questo insetto, Abu Oyoun, è un traditore, uno dei maiali di Al Saud	1	it
Onora tuo cugino, l'importante è che il Brasile non vinca la coppa e vedremo	0	it
Eccellenza, di cosa vuole essere ritenuto responsabile? Il Libano sta sprofondando in un labirinto di stagnazione, torbidità e accordi sospetti a spese della popolazione.	0	it
Puoi essere un comico senza dire cose sconce, senza essere scortese e senza sottovalutare nessuno!	0	it
Siamo in una specie di paese	0	it
Ma la cosa strana di questo rapporto è che i sauditi bevono urina di cammello, quindi sono scusati per il loro comportamento @user	1	it
Misericordia, amico mio, sei stanco di noi	0	it
Li uccidi, voglio dire, no, non segnano, lasciali andare e divertiti con loro, senza si annoieranno.	0	it
@user Questo è uno slogan indù	0	it
@user @user @user @user Sì, Muhammad, il Sudan ha indù che hanno 50 o 70 anni a Khartoum e... @url	0	it
Stai ancora dicendo che penso che tu sia in prigione	0	it
Crollerà sempre di più finché esisterà un importante modello di armonia nella nostra società	1	it
Le pile si sono accumulate su di noi	0	it
@user @user Hahaha, è urina di cammello. Ora hai aumentato la tua ignoranza. Se sei un Rafidi, non hai alcuna colpa, e se sei sunnita, allora le tue parole dimostrano che lo sei... @user	0	it
Ringraziamo Sua Eccellenza il Ministro Gebran Bassil per aver scelto il campo della politica, perché senza la sua presenza molti professionisti dei media sarebbero stati costretti a restare a casa prima...	0	it
E la merce sarebbe #ammissibile se non fosse per la differenza delle labbra	0	it
Uno dei motivi del fenomeno delle molestie nei confronti delle donne: @url	0	it
Ti ho visto, Valverde, maiale, Goooooooooooooooooooooooooooooooooooooooooooooooooooooooooooooooooooooooooooooooooooooooooooooooooooooooooooooooooo maialini, Malcolm	1	it
Tieni presente che il Qatar non ha altro che devastazione dietro di sé	0	it
Fratello, non ti meritiamo e non ti apprezziamo. Il tuo posto non è nell'ignoranza, il tuo posto è in Siria	0	it
Hahahahahahahahahaha non risponde perché è vergognoso, credetemi, ma se volete saperlo, e voleva davvero chiedermi del passato di Wahab, saprete la risposta.	0	it
Qualunque cosa dicano, non otterranno nulla. Possa Dio proteggere il professore e concedergli una lunga vita	0	it
Il calibro dell'urina di cammello mescolata con l'urina d'asino @user	1	it
Naturalmente sono tutte puttane e corrotte	1	it
@user @user Libero, cavalleresco, onorevole e autentico, malgrado il tuo naso, tu porco, tu e coloro che ti finanziano siete dei traditori, odiosi, dispettosi... @url	1	it
Questa è un’equazione coranica, Eccellenza, porteremo un popolo diverso da te e poi non sarà come te	0	it
Il modo migliore per ottenere retweet e mi piace è ritagliare parte di un’intervista al ministro Bassil, ovviamente una parte incompleta, e poi twittarla e dire: “Gibran è con la normalizzazione”.	0	it
Zain Al-Omar, ecco perché amo Gebran Bassil	0	it
Un forte attacco di Wahhab non fa altro che spingere il male	0	it
Non capisco come le persone giustifichino l'errore del padre! Vedete i vestiti non c'entrano niente con lui, è malato internamente e ha bisogno di cure psicologiche, insomma anche il padre ha paura di lui!!!... @url	0	it
@user @user Vengo dalla Somalia e vivo in Arabia Saudita. Giuro che ero uno dei partecipanti alla festa, ma il mio eroe ha mentito di più. Quelli che erano uguali alla folla dell'harem, il mio eroe hanno mentito.	0	it
Il Libano ha vissuto due casi	0	it
Per quanto le cose siano andate male con queste tendenze, ci sono momenti in cui mi perdo e leggo qualcosa per mezz'ora per capire chi è bloccato con chi e chi sta riattaccando ahah ​​e Fazra	0	it
Come i gatti mangiano e si nascondono	0	it
Il funzionario del Movimento Patriottico Libero Naji Hayek segue le orme del leader del movimento Gebran Bassil nel giustificare la normalizzazione con Israele.	0	it
"Ogni persona che mette una foto di Gebran Bassil come profilo sulla sua pagina e ritwitta i suoi tweet, mette ""mi piace"" al mio tweet ❤"	0	it
Carica la tua arma, mira al coltello e scendi in battaglia	0	it
Fratello mio malato, visita l'ospedale psichiatrico prima che la malattia maligna si diffonda in te	0	it
Un messaggio per un antico sé del passato, lo giuro	0	it
Dal discorso di Sua Eccellenza il Ministro Gebran Bassil in apertura del Summit Arabo	0	it
Non sei stato tu a dire che Wissam Al-Hassan aveva qualcosa a che fare con l'assassinio di Rafik Hariri, nel senso che tu e Othman vi ricattate a vicenda per allontanarvi dal mondo e ridurre il peso?	0	it
Ok, cosa ha fatto l'Arabia Saudita? Non ha sostenuto il terrorismo in Siria, e tu nella tua ultima apparizione lo elogi? Perché i doppi standard	0	it
Non gettate i vostri gioielli davanti ai porci, disse Gesù.	0	it
Dal punto di vista linguistico, smetta di essere fuorviante, signor Presidente del Partito Arabo Tawhid, sulla base	0	it
Voglio dire, questo è ciò che Gebran Bassil chiamava, se avesse fatto una cosa buona per il bene del Paese, dalla storia dell'elettricità, al passaporto libanese, se avesse fatto qualcosa...	0	it
Perdita di comprensione, dottore	0	it
Dove si colloca una persona nella scala sociale + la portata della sua capacità di influenzare l'ambiente circostante + la sua memoria e familiarità con gli affari di coloro che erano prima...	0	it
Uno dei riferimenti più importanti nel discorso di Sayyed Nasrallah è stata la menzione dei documenti Kilex riguardanti la fiducia nel presidente Aoun e nel ministro Gebran Bassil.	0	it
Tu che da tre giorni piangi sui maiali dell'organizzazione terroristica della chiesa	1	it
L'urina di cammello occupa un terzo... @user	0	it
Gebran Bassil, per la seconda volta consecutiva, riconosce il diritto di Israele all'esistenza e alla sicurezza	0	it
Volevo dire che noi e il Libano abbiamo bisogno di unità nazionale. Tutto può succedere a un popolo come questo, che è agente del nemico sionista e con tutta insolenza vuole osare attaccare i nostri fucili, che sono più puri di loro e i loro sostenitori. Se tutto va bene, arriverà il giorno in cui sapranno di non essere niente, solo mosche e niente più.	1	it
Secondo i dati circolanti, ci sarebbero promesse ricevute dal primo ministro Saad Hariri da parte dei paesi del Golfo di investire denaro	0	it
Gebran Bassil Forse dovremmo insegnare all'Occidente come gestire un paese senza budget	0	it
Se un dipendente è arrabbiato con il suo capo, ditegli quante ore in più vi darò e insultate Gebran Bassil.Il nostro compito è sederci e difenderci??	0	it
Non c’è alcun problema con Damasco, ma il problema riguarda il regime al potere a Damasco: la Siria non può essere ridotta al regime o alla persona di Bashar al-Assad.	0	it
Il vertice arabo sullo sviluppo economico e sociale ha approvato un’importante proposta libanese riguardante la crisi degli sfollati e dei rifugiati	0	it
Uccidete il morto e andate al suo funerale, voi gruppi di sorelle libanesi, e la storia non avrà pietà di voi. Maarab ha tradito il Libano.	1	it
I maiali si sporcano davvero la pelle	1	it
L'incontro di Wahhab con Khalda non è diretto contro nessuno	0	it
Eccellenza Ministro, la situazione è la stessa quando tu tifi per la sorella Siria e tutti gli arabi ci sono ostili. La nostra sfortuna è che tutte le squadre tifano all'estero, i...	0	it
Cancelliamo i tweet dell'intervista di Gebran Bassil e inviamoci i tweet di solidarietà al compagno Maduro.	0	it
Domani farà le valigie e ne prenderà un quarto, ma qui smetterà di fare il pane	0	it
Nabih Berri: Ho un ottimo rapporto con Sua Eccellenza il Presidente	0	it
Urgente: il ministro degli Esteri libanese Gebran Bassil, emiro del Qatar, ha rotto l'assedio che doveva essere imposto al vertice, e lo ringraziamo per il passo della sua partecipazione personale.	0	it
Sono davvero centri di ricerca?	0	it
@user @user I pipistrelli di oggi, Haden Hamlin, hashtag, che significa stare alzati fino a tardi o dormire è meglio. L'urina di cammello è alta... @user	0	it
Ti ricordi?	0	it
Se esistesse un Paese, ti metterebbero immediatamente in prigione	0	it
Se sei vicino alla casa di Gebran Bassil, vedi se è alla finestra	0	it
Questo è un video e una scena. Avete in mano gli atti dell'infrazione? Se sì, presentateli alla magistratura competente, senza diffamazione.	0	it
Caro Wiam, cosa significa “raadida”?	0	it
Dove sono i mille missili? Vedete, il Levante è diventato un setaccio	0	it
È vero che per uno come te che dipende dai soldi dell’Iran, il Libano è l’ultima preoccupazione	0	it
Saudita, siete tutti acidi, non orgogliosi	0	it
@user @user @user @user Urina di cammello. I tuoi antenati cavalcavano il cammello e si muovevano su di esso, non come... @user	0	it
Potete dirci chi sono questi tre eroi?	0	it
"Chi sei tu, Shakhakha, vuoi insegnare al mondo? Da quando sei diventata, Aouniya, capisci? Se avessi un po' di comprensione e onore, non cammineresti dietro a una persona disabile che ha venduto il suo onore al regime siriano e ha dormito in ""Le braccia del leone del crimine per assassinare i nostri leader e divorarci. Ci inseguiva e il suo nemico ci faceva saltare in aria e camminava sotto l'ala protettrice della milizia di Hassan Nasrallah. Torna indietro e guarda, Aouniya, il tuo libro arancione. Vuoi capisci cosa intendo?"	1	it
Quanto sono brave le persone di cui hai parlato?	0	it
Il signor presidente infedele Bashar al-Assad celebra il compleanno del Profeta. La saggia leadership ti ama	1	it
L'uomo si stava scusando con il Presidente della vostra Repubblica ed i suoi cognati erano preoccupati per la sua asma e chiamavano	0	it
Tu sei siriano, sicuramente druso, o alawita, o kharbatali. Stai zitto, vero, e io mi unirò a te	1	it
Sei abbastanza intelligente da twittare ahahah abbiamo finito, domani non eri al potere corrotto ma vieni come ministro e cambi idea	0	it
Dopo Wydad, la stella, e Mazembe, tocca a te, la sirena #Africa_oh_my_family	0	it
La destra è contro il popolo bruto, che è proprio il capo della setta, che striscia e si inginocchia, qualcuno gli si avvicina correndo e urlando sangue.	1	it
Occorre un nuovo lavaggio del cervello e tutto tornerà a posto, se Dio vorrà. Hanno legalizzato l'hashish	0	it
Dopo la decisione americana di punire i sostenitori di Assad durante la ricostruzione, è arrivata la notizia di una conferenza per la ricostruzione della Siria che si terrà nella capitale yemenita...	0	it
Abbiamo bisogno di un agente siriano, batterista del coro di Zmarlak, i figli di Anisa la puttana	1	it
Possa Dio rafforzare questa setta e benedire i suoi uomini liberi e i nostri sceicchi, nei quali vediamo la nostra situazione, possa tu vivere a lungo e lunga vita a Sua Eccellenza il Ministro	0	it
Napoleone, nonostante la sua bassa statura, occupava mezzo mondo	0	it
Un preparatore atletico viene processato con l'accusa di aver molestato una studentessa all'interno di una palestra	0	it
Eccellenza Ministro, il suo problema non è con il Qatar, il suo problema è con qualsiasi presidente o emiro che viene a un vertice, perché non vuole avere successo in un vertice dimostrando che sta con una squadra contraria al vertice.	0	it
Il ragazzo, Gebran Bassil, con un linguaggio incerto a causa di una mentalità disturbata, ritiene che l'emiro del Qatar abbia rotto l'assedio di Doha partecipando al vertice.	0	it
Dobbiamo essere un popolo per sapere cos’è una patria e cos’è questa patria	0	it
E gli attacchi ai beni comuni da parte di coloro che resistono, i tuoi alleati, perché chiudi un occhio su di essi, o portatore dello standard anticorruzione?	0	it
Quanto ha tenuto Wiam?	0	it
Dopo la scuola e i mariti che vanno al lavoro, la maggior parte degli harem perde affetto e romanticismo, nonostante l'atmosfera migliore sia quella mattutina, piatta... @url	0	it
Haha, saudita, questo è un apostata, da figlio a figlio, e la seconda cosa è curda	1	it
Sì, la Siria è il cuore pulsante dell’arabismo e il conquistatore del terrorismo wahhabita e akhwanji, agenti della NATO e di Israele, i cui muri sono stati abbattuti.	0	it
Un cane cristiano, Suleiman Franjieh, affiliato al Movimento Marada libanese, sta rastrellando il suo gruppo nella zona di Majalia e La Ariniyah.	1	it
Se Sayyed Nasrallah ha detto una cosa del genere, abbiamo tutti il ​​diritto di chiedere cosa stesse dicendo a chi l'ha raccontata. La storia di Gebran Bassil si ripete, quindi chi è questo?	0	it
Il discorso del ministro Gebran Bassil in apertura del vertice economico non è stato all’altezza delle aspirazioni dei libanesi, che invece di concentrarsi sull’informare le delegazioni su cosa...	0	it
In effetti, il più grande Paese arabo ha quasi il 100% delle sue decisioni interne, e lo Stato vi opera senza bilancio e senza governo.	0	it
Siamo d'accordo sul fatto che l'assassino applica la sua punizione a qualunque parte, partito, movimento, setta o autorità a cui appartenesse, e questo è il caso del defunto Muhammad Abu Diab.	0	it
Ad essere onesti, è incredibile che tu sia seduto tra le sue braccia e non gli tocchi il collo	0	it
Leader, vogliamo persone come te che temono Dio e dicano la parola della verità, e persone consapevoli che sappiano distinguere tra corruzione e arabismo.	0	it
