post	label	language
Il ministro Gebran Bassil, rispondendo alla domanda se le tensioni al confine meridionale del Libano con Israele lo tengono sveglio la notte.	0	it
Non essere il giudice della tua vita	0	it
Gebran Bassil è un uomo testardo che chiede il ripristino dei diritti dei cristiani che sono stati loro tolti a Taif, per questo è odiato dalla troika di Taif e dalla corruzione.	0	it
Possa tu vivere a lungo, o potente leader	0	it
Il Libano attende il titolo dell'articolo	0	it
La descrizione della sua condizione è di chi distribuisce accuse	0	it
Abbiamo spie come ministri	0	it
Haj Tissasa, non esiste niente del genere	0	it
Gebran Bassil sta insegnando all’America e a Londra come gestire un paese senza budget	0	it
Sei un circasso, cane, e soprattutto, dai la tua opinione, vile turco	1	it
Zio mio, che morale è andata? Si è evoluta in bestialità	0	it
@user @user Quattro anni e non entri da un mese. No, no, oggi sicuramente bevi molta urina di cammello. Perché bevi? Sei un cammello, figlio di cammello.	1	it
Vorrei sapere come la pensano e sono giunto alla conclusione che rifiuto delle molestie = invito al vizio!!!	0	it
Ancora un saluto al Ministro Gebran Bassil	0	it
Per Dio, sei una persona egoista che non ha niente a che fare con il generoso popolo del Libano. Quanto ti ha dato Al Saud per alimentare questo tweet?	0	it
Ok, ma il tuo problema è che Gebran Bassil non è il responsabile dell'organizzazione del vertice, ma ci sono degli organizzatori del vertice	0	it
Notizia documentata o scherzo? Giusto per sapere come agire	0	it
Ad esempio, prevenire le molestie #against_niqab_ban	0	it
@user Bruciamo tutti con il jazz sporco	0	it
Hahahahahaha chi dice questo Gibran Bassil I cristiani vogliono la normalizzazione dall'alto del tavolo	0	it
Non dubitiamo dell’equità della magistratura	0	it
La Siria è un paese di civiltà che lo collega a un animale o a un animale	0	it
È vietato soffrire per il dolore di Suleiman Al-Saghir. Sono arrivati ​​all'incrocio del Palazzo Baabda e sono tornati per fare un foglio bianco. È vietato piangere tutto il tempo...	0	it
I figli dei cammelli sono orgogliosi che i loro cammelli partecipino alla corsa, considerata la più grande conquista del Regno di Paolo il Cammello. Sono orgogliosi che sia più... @user	0	it
@user Cosa c'è che non va in te quando non hai postato la sua foto per convincermi? Vuol dire che il motivo per cui le donne guidano è la saudizzazione delle comunicazioni e il tasso di molestie è aumentato perché... @url	0	it
Quanto è grande l'esercito giordano?	0	it
"Sono stato solo oppresso dal libanese che ha twittato: ""Grazie, Qatar"". Ha lasciato il vertice subito dopo l'apertura"	0	it
E dove hai preso questo da noi? Tuo padre, Mu'tar Musaed, è seduto a guardare i profili delle persone. Dove hai preso tutte queste proprietà e questi soldi?	0	it
A proposito, aveva molta compagnia con mio nonno e lo nominò direttore generale della Regie, e quando pensarono ad un colpo di stato, misero mio nonno per un po' in prigione e poi con l'arresto forzato.	0	it
Professor Wiam, se il mare diventa bianco non ci sarà più corruzione nel Paese, lei ritiene che si debba combattere la corruzione.	0	it
Coloro che hanno creato Gibran per il Libano vogliono farlo per un anno	0	it
Chi lo merita è il più forte nel suo ambiente, credo e sono certo che Gebran Bassil sarà il più forte in termini di rappresentanza parlamentare.	0	it
Questo deve aprirvi la porta e convincervi che la cosiddetta rivoluzione siriana era solo mercenaria per stabilire nuove equazioni contro l’asse della resistenza.	0	it
Speriamo di fraintendere e che qualcuno che ci ama si arrabbi, ma il suo comportamento è sempre un attacco contro di noi	0	it
Si tratta del secondo caso in un anno che conferma la diffusione delle molestie sessuali in America: il primo è il caso #metoo (anche io)... @url	0	it
Una nazione araba	0	it
Abbiamo un detto secondo cui le uova marce si incubano a vicenda	0	it
È vero, Bashar Ibn Kalb, ma sono poche le persone che fanno questo ai siriani: un popolo siriano ipocrita e senza scrupoli che diventa profugo e vuole attaccare i suoi ospiti.	1	it
Allora ti ho comprato un animale e un cane, la tua ora è vicina, bastardo	1	it
Sfortunatamente, la Turchia è sull’orlo delle dieci economie più forti del mondo, mentre il Qatar vola alto e paga soldi per migliorare la situazione	0	it
Siamo orgogliosi di coloro che combattono apertamente la corruzione e arriviamo all’adozione del principio di efficienza in tutte le funzioni statali	0	it
Il discorso di Gebran Bassil ha disonorato lui e l'intera nazione araba	0	it
E le benedizioni della tua educazione	0	it
Nella loro rabbia, lanciano un gruppo di sciocchi pagati per insultare e intimidire ogni tweet	0	it
Siamo tutti con te, Sua Eccellenza Ministro Re Gebran Bassil	0	it
Il Primo Ministro Sheikh Saad Hariri è la corona della tua testa ed è più onorevole di te, della tua famiglia e di coloro che stanno dietro di te	0	it
Il mondo è una posizione e la posizione del prescelto è una linea rossa: non dimenticheremo i sacrifici dei socialisti e non dimenticheremo la famiglia Jumblatt.	0	it
Gebran Bassil minaccia la sicurezza di Israele	0	it
Un branco di cani lo distrusse e si sedette sulla sua collina	1	it
Abu Hadi, siamo orgogliosi di te, signor Presidente	0	it
Sapevate che l’equipaggiamento del tenente è costituito da un’uniforme militare e da un’arma di valore che sta di fronte al sionista che indossa equipaggiamento di valore?	0	it
@user @user @user Cioè, perché siete tutti nudi selvaggi... L'Iraq è il paese di Hammurabi e dei giardini pensili e della Mesopotamia e... @url	1	it
Voglio diventare uno chef, ingrassare e mangiare carne di maiale per sbaglio	0	it
Ora sei diventato arabo, non sei stato più un seguace dell’Iran e delle istruzioni del partito per tutta la vita	0	it
@user @user @user Amico mio, cosa stai facendo? Molto probabilmente urina di cammello	1	it
Queste molestie sono disgustose, disgustose, così disgustose	0	it
@user Questo è il tuo paese, la Palestina, porco, a causa di quelli come te, come Atwan, e dello stormo di terroristi di Hamas che si sono gettati in seno all'Iran... @url	1	it
Ho scoperto di essere un pervertito, non una perversione normale, no :(	0	it
Haha, congratulazioni a me per questo laham, se lo stato arabo dell'Iran se ne va in questo modo, e se tutti voi siete così, buon per voi.	1	it
Alzati, siriano, tieni la testa bassa, Sarmaya	0	it
Gli atei sono mucche, fratello	1	it
Il governo saudita annuncia una gara d'appalto per lo scavo di un canale lungo il confine con il Canada	0	it
Questa frase è stata commentata dalla dottoressa Marwa Al-Arjani in una scena (televisiva) in cui una donna adornata appare in mezzo a loro!!!!!!!!…	0	it
In questa epoca sono pochi gli uomini che dicono la verità, che Dio vi protegga	0	it
Ci sono alcuni facchini che trasportano sacchi pieni di sacchi, facendo lavori sporchi come loro davanti all’hotel della squadra in Libano	0	it
Sai che tutti quelli che lodi ridono e ti prendono in giro	0	it
"C'è un vecchio, non so che cosa abbia sua madre, più di una volta entra in casa e ci mette tristezza. Si siede e guarda, e gli dicono: ""Scendi, non scende e va'"". giù e guarda."" Sembra sporco... @url"	0	it
Grazie, Gebran Bassil, per essere la nostra garanzia	0	it
Merita risposte violente finché il Libano non lo dissuade	0	it
Se mai esistesse un Paese, Eccellenza Ministro, il tuo posto sarebbe dietro le sbarre per l'oscenità della tua lingua, il tuo disprezzo per la magistratura e la tua ribellione contro le forze legittime.	0	it
Ci siamo riusciti con le nostre forze. Grazie a Sua Eccellenza il Presidente e a Sua Eccellenza il Ministro Gebran Bassil	0	it
Sì, ha ragione, se Israele raggiunge la pace con la Palestina, il Libano, la Giordania e i paesi arabi, dov'è il problema? Ma così, Gebran Bassil	0	it
Dormi bene, Tasham, basta stupidaggini per oggi, non vuoi lasciare nulla per domani	1	it
@user @user @user @user @user Perché sei sporco e figlio di un cane e hai sostenuto il cane libanese!! Siete tutti cani, qual è il problema???	1	it
Non trasmette più poesia, non trasmette più Saddam Hussein	0	it
Non sono responsabile della disabilità intellettiva di persone come lei, Eccellenza	0	it
Verani è vero, allevato in laboratorio, ma nero e grigio	0	it
@user @user @user Il nostro disaccordo con Al-Shawal è dovuto al fatto che ha interferito negli affari del nostro club e quindi ci causerà danni in ogni modo... @url	0	it
Mi chiedo quale sia la posizione di Hamas riguardo al barbaro bombardamento del campo di Yarmouk	0	it
Gibran Bassil, e a dire il vero, se qualcuno vuole essere arrabbiato, per favore, torni e costringimi a tornare e dire che il Libano è forte con la presenza del Sig.	0	it
#Saudi_women_we_demand_abolition_of_the_guardianship 800 La tutela sarà sui minori, sugli sciocchi e sui pazzi	0	it
@user I Bani Ya'arab hanno perso tutto il fieno ficcato nelle loro teste arrugginite? A quanto pare è Captagon o l'urina di cammello che stanno prendendo... @url	1	it
Eccellenza, temo che si troverà in un Paese forte	0	it
Un poeta mi ha detto: “Se solo i politici fossero donne”.	0	it
@user Questo è il vostro metodo, voi cani dei Magi (ovviamente non vi preoccupate dell'importante distruzione di Teheran e del corteo di Saddam Hussein, voi popolo impuro ((Se non fosse per voi, non avremmo... @url	1	it
Insisti ancora nell'usare lo stesso metodo, quindi questa è la mia risposta	0	it
Il miglior gol segnato dai lenti	0	it
Wiam è un emblema del progresso umano in Libano. Siamo costantemente ispirati dalla cultura della consapevolezza della resistenza e dalla volontà di essere audaci e cambiare. La tua voce è Wiam.	0	it
Abbiamo bisogno di ogni lettera della parola, abbiamo bisogno dell'esilio, dell'Africa, della pace più preziosa	0	it
#La_capra_tolettata	0	it
Marta, quella che ha sigillato la palla, ha attaccato l'harem	0	it
Intendi parlare di te, che non hai voluto nascondere nulla il giorno dopo aver impedito il ricovero di Muhammad Abu Dhiyab in un ospedale vicino e averlo ricoverato in un ospedale, purtroppo, partigiano.	0	it
Gebran Bassil è rimasto molto turbato quando ha detto che voleva vivere in Siria, e che mentre è nel suo paese, il Libano, non può vivere in pace.	0	it
Grazie per essere sempre gentile e generoso con noi, Sheikh Nasr al-Din al-Gharib	0	it
Dhaba, Dabaa, la gente di Deiriya non è araba	0	it
L'orda Baath, spazzeremo via gli iraniani e i russi dalla terra, cane. Non continuare a demolire i calderoni o a governare il tuo paese dopo che sarai disposto a partecipare.	1	it
Othman protegge i corrotti nelle forze di sicurezza, il che lo rende il loro partner	0	it
C'è una cosa che invidio i bambini: sono capaci di riunirsi e camminare insieme, eppure corrono dietro all'harem, come stupidi.	0	it
@user Non è necessario che tu diffonda, per Dio, la tua morale è migliore per te della fama a scapito della tua religione. Appari adornato, scoprendo i tuoi capelli. Per Dio, ti consiglio di lasciare questo campo.	0	it
La presenza di Tamim in Libano è stata molto gradita	0	it
@user Hai lasciato qualcosa dietro per attuare un'agenda magi-persiana-iraniana-ebraica? Qual è la visita del più grande nemico dell'Islam e dell'Islam... @user	0	it
Sarebbe meglio che il Ministro degli Esteri Gebran Bassil, che sta coraggiosamente collaborando con il Presidente della Repubblica per riportare la Siria nella Lega Araba, concentrasse i suoi sforzi e quelli del Patto.	0	it
Devi affrontarli, Weam. Non rimanere in silenzio. Non rimanere in silenzio. Non tirarti indietro. Un uomo, un figlio di un uomo, e sii come ti conosciamo	0	it
Ok, previeni le prime molestie #against_niqab_ban	0	it
Possa tu vivere a lungo, o Wiam Wahhab, o Principe di Cuori	0	it
@user Dopo essersi ritirato dai maiali della Germania, un uomo si è preso la libertà nella religione e nel credo	0	it
Tutto arriverà a te al momento stabilito, quindi devi padroneggiare la pazienza	0	it
Gebran Bassil, genero del presidente, è evitato dalla maggior parte dei partiti libanesi che, insieme al presidente, attuano l’agenda di Damasco e dell’Iran.	0	it
Un po' più grandi delle scarpe	0	it
Gebran Bassil è un uomo che non si stanca mai di lavorare per il successo della politica estera del Libano	0	it
L'assassino di Kamal Jumblatt, l'assassino di Hariri, Gibran Tueni, Samir Kassir, Salim al-Lawzi, Sheikh Hassan Khaled e Kattar di...	0	it
@user Non vogliamo maiali	1	it
Il tuo reddito non è voluto dalla magistratura	0	it
Ho depositato un miliardo perché il Partito Satana in Libano sta attraversando una fase difficile dopo che il sostegno iraniano è cessato a causa del blocco	1	it
Vuoi la prigione, niente patria o qualsiasi altra cosa	0	it
Gebran Bassil ha minacciato Israele riguardo alla sua sicurezza e ha affermato che se Israele vuole veramente garantire la sua sicurezza e questo è un suo diritto, allora deve...	0	it
O marcio druso, Faisal Qasim, qual è il tuo commento sul dolce Sarsari? O Fasoun, i drusi sono traditori.	1	it
Professor Wiam, il video ha raccolto storie per lei per anni. Non va bene. Penso che dovrebbe cambiarlo comunque. Lei vuole l'idea.	0	it
Molto, molto bello, è così	0	it
È la mummia libanese. Il Libano è diventato come una mummia mummificata, portatrice di storia ma senza vita	0	it
È sempre la persona più provocatoria su Hawa Al Hurriya TV	0	it
@utente Ah-ah-ah-ah-ah-ah-ah-ah-ah-ah-ah-ah-ah-ah-ah-ah-ah-ah-ah-ah-ah-ah-ah-ah- ah-ah-ah-ah-ah-ah-ah-ah-ah-ah-ah-ah-ah-ah-ah-ah-ah-ah-ah-ah-ah-ah-ah-ah-ah-ah- ah-ah-ah-ah-ah-ah-ah-ah-ah-ah-ah-ah-ah-ah-ah-ah-ah-ah-ah-ah-ah-ah-ah-ah-ah-ah- ahah	1	it
Attraverso alcune informazioni e fughe di notizie ottenute dagli amici del Movimento Libanese Libero, ci hanno assicurato che il costo per coprire la presenza del ministro degli Esteri Gebran con...	0	it
Di che tipo di democrazia stai parlando? Voi donne non avete una cosa come la democrazia. Siete solo Nakad e le sue sorelle.	1	it
Ogni persona che diffama e danneggia la reputazione di Gebran Bassil dovrebbe essere ritenuta responsabile	0	it
Chi parla di protezione e di facilitazione del passaggio, e Ali Al-Amin è caduto dalle scale?	0	it
Divenne una delle sue condizioni che diventassero fratelli insieme	0	it
Azmi Bishara dice: I rifugiati palestinesi non sono stati un peso per nessuno, né sono stati invano, ma piuttosto hanno formato una società attiva, produttiva e lavorativa... @url	0	it
Deve generalizzare vero	0	it
La pace sia con te e che la tua lingua sia benedetta	0	it
Per vostra informazione, Eccellenza, nonostante le tante promesse del Movimento Libero e del resto di marzo, nessun alawita è riuscito a farcela. Questa è una farsa.	0	it
Il terrorismo saudita è consegnato ai bidoni della spazzatura della storia, e tutti stanno tirando le fila della domanda: perché questa sconsideratezza, e la Siria dovrebbe...	1	it
@user Questo è quello che devi dire sporco e insultare l'onore della gente, ma nello stadio ci sono i gerbilli davanti a noi e l'ultima cosa sono i Mondiali, penso che tu abbia dimenticato	1	it
Non so come il Libano si sia permesso di accettare un simile mostro, di essere presente al vertice della diversità, della civiltà e dell’arte del Libano	0	it
I giornalisti vicini alla resistenza, compreso te, vedono il ministro Gebran Bassil da una prospettiva, con un solo difensore	0	it
Quanto avremmo voluto essere in uno Stato di diritto e istituzioni, e Muallem Imad Othman non avrebbe raggiunto la carica di primo ministro.	0	it
Giuro su Dio, ti sei procurato questa umiliazione perché te la meriti, non sei come Sheikh Saad, che ti rispetta e non risponde.	0	it
Per quanto riguarda la festa di demonizzazione in corso, non so quale sia il suo vantaggio	0	it
Sì, tu contadino, tu povero, tu persona insignificante, tu druso, tu parli dei siriani e sei il primo a desiderare la loro morte e il loro annientamento e che rimanga la tua setta drusa, tu insetto.	1	it
Come un leone accovacciato	0	it
Non importa quando è avvenuta, ma questa azione è qualcosa di cui abbiamo disperatamente bisogno in Libano per il bene di tutti i politici, senza eccezioni, dai più anziani ai più giovani...	0	it
Un bellissimo video cartoon per proteggere i bambini dalle molestie..	0	it
E contrabbandano i maiali wahhabiti che hanno fatto saltare in aria gli hotel di Beirut, tesoro. @url	1	it
Il Qatar deposita in banca e prende gli interessi, e se ci sono statisti in Libano che riescono a gestire questi soldi con saggezza e onestà, otterranno profitti...	0	it
Capisco che sei nascosto	0	it
@user Che la maledizione di Dio sia su di te, maiale, figlio di un criminale.	1	it
I maiali di tutto il mondo sono felici e scodinzolano, e con loro ci sono gran parte degli arabi del Nord, anneriti dalle facce dei mangiatori ingrati e meschini, e loro... @url	1	it
Wiam Wahhab è una delle persone più onorevoli, un politico onesto e franco e un patriota sincero	0	it
Le molestie contro una donna restano molestie	0	it
Egli è vostro padre, non il padre dell'esercito d'Israele, voi tutti siete cani	1	it
@user Non avete altro che un insulto a Khashoggi, voi Khawarij, o per coprire sanzioni onorevoli e ferro libero, voi maiali?	1	it
Questo è un pazzo ufficiale o sta progettando di diventare una pecora a Baabda?	0	it
Ahmed Aboul Gheit, in una conferenza stampa con Gebran Bassil, dice a un giornalista che è avido di porre tre domande basate sulle sue parole e sulla sua posizione di Al-Mahrous.	0	it
Congratulazioni al Libano, da stasera abbiamo internet super veloce in alcune zone grazie all'avvio del progetto della fibra ottica, speriamo di avere l'elettricità.	0	it
Io dico che sei povero e forse ieri ti sei addormentato per aver bevuto alcolici, ti dico che ieri Israele ha bombardato Damasco e il suo aeroporto è stato danneggiato.	0	it
Questo è un qatarino che non sa che l'emiro del Qatar ha consegnato il Qatar all'immorale turco, il che significa che rimarrai senza casa	1	it
Wahhab, che cammina con la benedizione dei nostri venerabili sceicchi, sarà vittorioso, a Dio piacendo	0	it
Sembra che l'urina del cammello sia pura per tutta la sua durata @url	0	it
Cosa stai facendo? Rimani nel caso Khashoggi e non interferire con qualcosa di più grande di te e difficile da comprendere per la tua mente.	0	it
Questo mercato è un'estensione di Al-Gharbally Street, di fronte al mercato Al-Harem, fino al muro del cimitero,…	0	it
Dopo aver confermato che non esiste alcun disaccordo ideologico con Israele, il potente ministro degli Esteri dell'epoca, Gebran Bassil, conferma in un'intervista alla CNN che...	0	it
Dalle voci di stupri nelle carceri e sui rifugiati africani alla storia dei langos e degli stimolatori sessuali e alla loro promozione nei media...	0	it
Oh Ahmed, dov'è Gebran Bassil con il tweet, ma hai qualcosa in mente, amore mio	0	it
Damasco è un luogo amorevole per gli arabi, una madre misericordiosa, un padre compassionevole e un fratello premuroso, ma gli arabi la bramavano, erano crudeli con lei e volevano distruggerla...	0	it
Sisi: I rifugiati vivono una vita dignitosa in Egitto!! @url	0	it
WikiLeaks ha rivelato quanto Gebran Bassil e il generale Aoun fossero leali alla resistenza, non come gli altri, ma questo è tutto.	0	it
